{
  "formatVersion": "0.9",
  "id": "bench",
  "version": "1.0.0",
  "name": "Bench",
  "category": "furniture",
  "scene": "object.glb",
  "license": "CC0-1.0",
  "attribution": [
    {
      "path": ".",
      "author": "Example Author",
      "license": "CC0-1.0"
    }
  ],
  "bounds": {
    "min": [
      -0.8,
      0,
      -0.25
    ],
    "max": [
      0.8,
      0.85,
      0.25
    ]
  },
  "traits": {
    "collidable": {
      "node": "proxy"
    },
    "movable": {},
    "seat": {
      "capacity": 2,
      "anchors": [
        {
          "id": "left",
          "position": [
            -0.4,
            0,
            0.55
          ],
          "yaw": 0,
          "height": 0.45
        },
        {
          "id": "right",
          "position": [
            0.4,
            0,
            0.55
          ],
          "yaw": 0,
          "height": 0.45
        }
      ]
    }
  }
}
